{
  "id": "num_sv_legit_01",
  "category": "number_preservation",
  "case_class": "structural",
  "text_format": "plain",
  "field_semantics": "generic",
  "source_text": "Dose is 1.5 ml",
  "expected_invariants": {},
  "difficulty": "normal",
  "notes": "Legitimate SV decimal comma must not flag number corruption."
}
