{
  "id": "sci_03",
  "category": "scientific_terminology",
  "case_class": "terminology",
  "text_format": "plain",
  "field_semantics": "body",
  "source_text": "Lyophilized peptides should be stored at −20°C until reconstitution.",
  "expected_invariants": {
    "numbers": [
      "20"
    ]
  },
  "difficulty": "hard",
  "notes": ""
}
