{
  "id": "gut_03",
  "category": "gutenberg_plain",
  "case_class": "free",
  "text_format": "plain",
  "field_semantics": "paragraph",
  "source_text": "If you have questions about storage conditions, contact the research support desk.",
  "expected_invariants": {},
  "difficulty": "normal",
  "notes": ""
}
